A1: Engines | B1: Speed | C1: New | D1: Old | E1: % change
A2: 1000 (Electric) | B2: 135 | C2: 122572 | D2: 142888 | E2: =C2/D2-1 -> -0.14218128884161019
A3: 1044 (Electric) | B3: 160 | C3: 181847 | D3: 278104 | E3: =C3/D3-1 -> -0.3461187181773725
A4: 140C (Steam) | B4: 80 | C4: 38538 | D4: 37392 | E4: =C4/D4-1 -> 3.0648267008985819E-2
A5: 141TA (Steam) | B5: 70 | C5: 27084 | D5: 32592 | E5: =C5/D5-1 -> -0.16899852724594988
A6: 150B (Steam) | B6: 105 | C6: 69709 | D6: 58107 | E6: =C6/D6-1 -> 0.19966613316812087
A7: 1600 (Electric) | B7: 180 | C7: 197424 | D7: 188594 | E7: =C7/D7-1 -> 4.6820153345281446E-2
A8: 2100 (Diesel) | B8: 80 | C8: 43915 | D8: 57869 | E8: =C8/D8-1 -> -0.24113082997805391
A9: 26000 (Electric) | B9: 200 | C9: 265028 | D9: 315385 | E9: =C9/D9-1 -> -0.15966834186787582
A10: 27000 /NS 1500(Electric) | B10: 145 | C10: 131854 | D10: 121379 | E10: =C10/D10-1 -> 8.6299936562337809E-2
A11: 422 (Diesel) | B11: 124 | C11: 84090 | D11: 75468 | E11: =C11/D11-1 -> 0.1142470981078072
A12: 6300 (Steam) | B12: 90 | C12: 44314 | D12: 40562 | E12: =C12/D12-1 -> 9.250036980425036E-2
A13: 895 (Steam) | B13: 40 | C13: 9278 | D13: 13232 | E13: =C13/D13-1 -> -0.29882103990326481
A14: Ae 6-6 (Electric) | B14: 125 | C14: 133703 | D14: 222168 | E14: =C14/D14-1 -> -0.39818965827661945
A15: ALCo-GE-IR Boxcar (D) | B15: 100 | C15: 39888 | D15: 21327 | E15: =C15/D15-1 -> 0.87030524687016464
A16: Big Boy (Steam) | B16: 130 | C16: 385361 | D16: 181776 | E16: =C16/D16-1 -> 1.1199773347416602
A17: c5/6 (Steam) | B17: 65 | C17: 32813 | D17: 37044 | E17: =C17/D17-1 -> -0.11421552748083363
A18: Ce 4/4 (Electric) | B18: 65 | C18: 28045 | D18: 34912 | E18: =C18/D18-1 -> -0.19669454628780936
A19: Class 66 (Diesel) | B19: 120 | C19: 92317 | D19: 107303 | E19: =C19/D19-1 -> -0.13966058730883568
A20: Class 67 (Diesel) | B20: 120 | C20: 67662 | D20: 52651 | E20: =C20/D20-1 -> 0.28510379669901798
A21: Class A4 Mallard (Steam) | B21: 160 | C21: 109537 | D21: 86476 | E21: =C21/D21-1 -> 0.26667514686155691
A22: Daylight (Steam) | B22: 140 | C22: 106388 | D22: 95637 | E22: =C22/D22-1 -> 0.11241465123330929
A23: Dr12 (Diesel) | B23: 120 | C23: 81384 | D23: 66197 | E23: =C23/D23-1 -> 0.22942127286735059
A24: Ds3 | B24: 160 | C24: 179017 | D24: 255331 | E24: =C24/D24-1 -> -0.29888262686473632
A25: E04 01 (Electric) | B25: 110 | C25: 84004 | D25: 106811 | E25: =C25/D25-1 -> -0.21352669668854329
A26: E55200 | B26: 120 | C26: 109413 | D26: 190224 | E26: =C26/D26-1 -> -0.42482021196063591
A27: E646 (Electric) | B27: 140 | C27: 155245 | D27: 253332 | E27: =C27/D27-1 -> -0.38718756414507449
A28: EMD GL8 | B28: 124 | C28: 63973 | D28: 37511 | E28: =C28/D28-1 -> 0.70544640238863265
A29: ET41 (Electric) | B29: 125 | C29: 99253 | D29: 110016 | E29: =C29/D29-1 -> -9.7831224549156492E-2
A30: F3 (Diesel) | B30: 105 | C30: 70535 | D30: 53275 | E30: =C30/D30-1 -> 0.32397935241670583
A31: Genesis (Diesel) | B31: 177 | C31: 173013 | D31: 149240 | E31: =C31/D31-1 -> 0.15929375502546228
A32: GM-EMD-J16CW-AC | B32: 90 | C32: 46326 | D32: 59556 | E32: =C32/D32-1 -> -0.22214386459802538
A33: HLE 13 (Electric) | B33: 200 | C33: 260267 | D33: 292356 | E33: =C33/D33-1 -> -0.10976001860745122
A34: IORE (Electric) | B34: 80 | C34: 313660 | D34: 627102 | E34: =C34/D34-1 -> -0.49982618457603389
A35: KZ2A (Electric) | B35: 210 | C35: 275931 | D35: 276297 | E35: =C35/D35-1 -> -1.3246615055537703E-3
A36: Re460 / Lok 2000 (Electric) | B36: 230 | C36: 339985 | D36: 355483 | E36: =C36/D36-1 -> -4.3597021517203349E-2
A37: LRC (Diesel) | B37: 180 | C37: 162487 | D37: 128305 | E37: =C37/D37-1 -> 0.26641206500136394
A38: MaK (Diesel) | B38: 75 | C38: 23190 | D38: 22008 | E38: =C38/D38-1 -> 5.3707742639040434E-2
A39: Metrovic EM2 | B39: 145 | C39: 127995 | D39: 104611 | E39: =C39/D39-1 -> 0.22353289806999266
A40: MLW M420W (Diesel) | B40: 108 | C40: 73832 | D40: 75190 | E40: =C40/D40-1 -> -1.8060912355366443E-2
A41: MTAB Dm3 (Electric) | B41: 75 | C41: 195796 | D41: 381518 | E41: =C41/D41-1 -> -0.48679747744536295
A42: NER EF1 | B42: 40 | C42: 19477 | D42: 31888 | E42: =C42/D42-1 -> -0.38920597089814346
A43: Okz 32 (Steam) | B43: 75 | C43: 35695 | D43: 42300 | E43: =C43/D43-1 -> -0.15614657210401894
A44: Royal Hudson (Steam) | B44: 144 | C44: 164460 | D44: 121640 | E44: =C44/D44-1 -> 0.35202236106543894
A45: SDP-40F (Diesel) | B45: 153 | C45: 128776 | D45: 104337 | E45: =C45/D45-1 -> 0.23423138483951034
A46: Sharknose (Diesel) | B46: 140 | C46: 100564 | D46: 63264 | E46: =C46/D46-1 -> 0.58959281740010105
A47: Sr1 (Electric) | B47: 140 | C47: 130542 | D47: 170409 | E47: =C47/D47-1 -> -0.23394891114905902
A48: SS6 (Electric) | B48: 100 | C48: 117017 | D48: 238682 | E48: =C48/D48-1 -> -0.50973680461869764
A49: TEP150 (Diesel) | B49: 160 | C49: 147391 | D49: 141425 | E49: =C49/D49-1 -> 4.2184903659183259E-2
A50: V200 (Diesel) | B50: 140 | C50: 93715 | D50: 77235 | E50: =C50/D50-1 -> 0.21337476532660071
A51: VL15 (Electric) | B51: 100 | C51: 118538 | D51: 223463 | E51: =C51/D51-1 -> -0.4695408188380179
A52: WCM-1 | B52: 104 | C52: 94502 | D52: 134760 | E52: =C52/D52-1 -> -0.29873849807064412
A53: WDM-2 | B53: 120 | C53: 82370 | D53: 80418 | E53: =C53/D53-1 -> 2.4273172672784726E-2
A54: Metros
A55: 81-729 | B55: 100 | C55: 47247 | D55: 36781 | E55: =C55/D55-1 -> 0.28454908784426736
A56: Boston 01800 | B56: 80 | C56: 30548 | D56: 30897 | E56: =C56/D56-1 -> -1.1295595041589834E-2
A57: Budapest 1894 | B57: 60 | C57: 15015 | D57: 13810 | E57: =C57/D57-1 -> 8.725561187545261E-2
A58: CAF 90 | B58: 70 | C58: 26088 | D58: 28370 | E58: =C58/D58-1 -> -8.0437081424039492E-2
A59: Cairo 1987 | B59: 80 | C59: 30254 | D59: 25862 | E59: =C59/D59-1 -> 0.16982445286520753
A60: DLR Metro | B60: 80 | C60: 28620 | D60: 27924 | E60: =C60/D60-1 -> 2.4924795874516459E-2
A61: ev3-200 | B61: 100 | C61: 46566 | D61: 30394 | E61: =C61/D61-1 -> 0.53207869974337041
A62: London 1903 stock | B62: 70 | C62: 23297 | D62: 18855 | E62: =C62/D62-1 -> 0.23558737735348712
A63: London 1938 stock | B63: 70 | C63: 23345 | D63: 26598 | E63: =C63/D63-1 -> -0.12230242875404163
A64: M100 | B64: 90 | C64: 37706 | D64: 32713 | E64: =C64/D64-1 -> 0.15263045272521625
A65: M2 840 | B65: 80 | C65: 29516 | D65: 24528 | E65: =C65/D65-1 -> 0.20335942596216561
A66: MP89 | B66: 100 | C66: 45111 | D66: 33127 | E66: =C66/D66-1 -> 0.36175929000513185
A67: Tokyo | B67: 120 | C67: 67129 | D67: 41839 | E67: =C67/D67-1 -> 0.60445995363177896
A68: Type M1 | B68: 90 | C68: 37548 | D68: 31483 | E68: =C68/D68-1 -> 0.19264364895340336
A69: U-Bahn C II | B69: 60 | C69: 18757 | D69: 17529 | E69: =C69/D69-1 -> 7.0055336870329166E-2
A70: Brooklyn union gate car | B70: 60 | C70: 14711 | D70: 13945 | E70: =C70/D70-1 -> 5.4930082466833952E-2
A71: Pyongynag D Stock | B71: 100 | C71: 45153 | D71: 27433 | E71: =C71/D71-1 -> 0.6459373746947108
A72: xMUs
A73: 2200 EMU (Electric) | B73: 160 | C73: 126298 | D73: 61880 | E73: =C73/D73-1 -> 1.0410148674854556
A74: 4041 (Electric) | B74: 80 | C74: 36002 | D74: 27088 | E74: =C74/D74-1 -> 0.32907560543414061
A75: 594 TRD (Diesel) | B75: 160 | C75: 102942 | D75: 45407 | E75: =C75/D75-1 -> 1.2670953817693307
A76: 811 DMU (Diesel) | B76: 118 | C76: 56575 | D76: 34467 | E76: =C76/D76-1 -> 0.64142513128499723
A77: BDVmot (Electric) *** | B77: 120 | C77: 81283 | D77: 78528 | E77: =C77/D77-1 -> 3.5083027709861492E-2
A78: BM65 (Electric) | B78: 70 | C78: 24240 | D78: 25987 | E78: =C78/D78-1 -> -6.7225920652633997E-2
A79: BM73 (Electric) | B79: 220 | C79: 246369 | D79: 84752 | E79: =C79/D79-1 -> 1.906940249197659
A80: BM93 (Diesel) | B80: 140 | C80: 75200 | D80: 38140 | E80: =C80/D80-1 -> 0.97168327215521755
A81: BR Class 168 (Diesel) | B81: 160 | C81: 106771 | D81: 58490 | E81: =C81/D81-1 -> 0.82545734313557872
A82: Cargo Sprinter (Diesel) | B82: 140 | C82: 76746 | D82: 41767 | E82: =C82/D82-1 -> 0.83747934972586013
A83: DDAR (Electric) | B83: 160 | C83: 149205 | D83: 133449 | E83: =C83/D83-1 -> 0.11806757637749254
A84: EMU 680 (Electric) | B84: 230 | C84: 267410 | D84: 74950 | E84: =C84/D84-1 -> 2.5678452301534356
A85: ET 420 (Electric) | B85: 120 | C85: 70526 | D85: 49214 | E85: =C85/D85-1 -> 0.4330475068070061
A86: ETR 200 (Electric) | B86: 160 | C86: 119641 | D86: 45714 | E86: =C86/D86-1 -> 1.6171632322702019
A87: ETR500 (Electric) | B87: 250 | C87: 417408 | D87: 524084 | E87: =C87/D87-1 -> -0.20354752291617373
A88: HSA (Electric) | B88: 300 | C88: 472940 | D88: 105171 | E88: =C88/D88-1 -> 3.4968670070646848
A89: Hunter Railcar (Diesel) | B89: 160 | C89: 99921 | D89: 43288 | E89: =C89/D89-1 -> 1.3082840510072073
A90: IC125 | B90: 201 | C90: 195941 | D90: 160656 | E90: =C90/D90-1 -> 0.21963076386814073
A91: IC4 | B91: 200 | C91: 262986 | D91: 313691 | E91: =C91/D91-1 -> -0.16163995779285989
A92: ICE-3 (Electric) | B92: 330 | C92: 591921 | D92: 130438 | E92: =C92/D92-1 -> 3.5379490639230902
A93: ICM (Electric) | B93: 160 | C93: 122952 | D93: 50977 | E93: =C93/D93-1 -> 1.4119112540949841
A94: Lint 41 (Diesel) | B94: 120 | C94: 54271 | D94: 30738 | E94: =C94/D94-1 -> 0.76559958357733104
A95: Mat24 (Electric) | B95: 100 | C95: 45506 | D95: 34228 | E95: =C95/D95-1 -> 0.32949631880331887
A96: OSCars (Electric) | B96: 130 | C96: 81776 | D96: 49667 | E96: =C96/D96-1 -> 0.64648559405641581
A97: Plan Y (Electric) | B97: 125 | C97: 74285 | D97: 38756 | E97: =C97/D97-1 -> 0.91673547321705029
A98: radbe510 (Electric) | B98: 125 | C98: 79458 | D98: 55190 | E98: =C98/D98-1 -> 0.4397173400978438
A99: rbde560 (Electric) | B99: 140 | C99: 94469 | D99: 57828 | E99: =C99/D99-1 -> 0.63362039150584493
A100: Sm2 (Electric) | B100: 120 | C100: 64854 | D100: 32862 | E100: =C100/D100-1 -> 0.97352565272959657
A101: Sm4 (Electric) | B101: 160 | C101: 125094 | D101: 54322 | E101: =C101/D101-1 -> 1.3028239019181913
A102: TGV Atlantique | B102: 300 | C102: 576997 | D102: 559253 | E102: =C102/D102-1 -> 3.1728037221078864E-2
A103: TGV Duplex | B103: 300 | C103: 584522 | D103: 597602 | E103: =C103/D103-1 -> -2.1887476949541629E-2
A104: TGV Thalys | B104: 300 | C104: 576997 | D104: 559253 | E104: =C104/D104-1 -> 3.1728037221078864E-2
A105: VT 612 " RegioSwinger" (Diesel) | B105: 160 | C105: 109714 | D105: 64635 | E105: =C105/D105-1 -> 0.69743946778061416
A106: X2000 (Electric) | B106: 210 | C106: 249611 | D106: 192490 | E106: =C106/D106-1 -> 0.29674788300690946
A107: Y2 DMU (Diesel) | B107: 180 | C107: 128321 | D107: 46052 | E107: =C107/D107-1 -> 1.7864370711369757
A108: Railcars | C108: 0 | D108: 0
A109: 121 Railcar (Diesel) | B109: 113 | C109: 42310 | D109: 15773 | E109: =C109/D109-1 -> 1.6824320040575667
A110: 479 Railcar (Electric) | B110: 50 | C110: 10201 | D110: 10643 | E110: =C110/D110-1 -> -4.1529643897397328E-2
A111: 809 Railcar (Diesel) | B111: 80 | C111: 21418 | D111: 14444 | E111: =C111/D111-1 -> 0.4828302409304901
A112: AR 2 (Diesel) | B112: 120 | C112: 52971 | D112: 26182 | E112: =C112/D112-1 -> 1.023183866778703
A113: DM7 (Diesel) | B113: 95 | C113: 30582 | D113: 16944 | E113: =C113/D113-1 -> 0.80488668555240794
A114: Kinki DMU | B114: 80 | C114: 21473 | D114: 14515 | E114: =C114/D114-1 -> 0.47936617292456085
A115: Leyland Railbus (Diesel) | B115: 100 | C115: 33518 | D115: 15562 | E115: =C115/D115-1 -> 1.1538362678318981
A116: VT 133 (Diesel) | B116: 56 | C116: 9088 | D116: 7319 | E116: =C116/D116-1 -> 0.24169968574941936